{
  "schema_version": "1.0",
  "artifact_kind": "pooleos_native_boot_handoff_readiness",
  "status_date": "2026-07-16",
  "status": "pass_single_host_synthetic_non_promoting",
  "contract_id": "PBP1",
  "selected_move_id": "N5-BOOTPROTO-001",
  "production_ready": false,
  "production_promotion_allowed": false,
  "n5_exit_gate_satisfied": false,
  "phase_status": {
    "N5": "partial",
    "N5.8": "partial"
  },
  "bindings": {
    "contract": {
      "path": "specs/native-boot-handoff-contract.json",
      "sha256": "89EA7517EF7D2E30C7EBEC4C28D092E3F01D95519EC6768E7B4D5C0F586B58E7",
      "byte_count": 16126
    },
    "contract_schema": {
      "path": "specs/native-boot-handoff-contract.schema.json",
      "sha256": "CCC8FB6B593BD737DA0903FB98C1FF7368A2B783A50924C7196A864BAA170344",
      "byte_count": 3996
    },
    "golden_vectors": {
      "path": "specs/native-boot-handoff-golden-vectors.json",
      "sha256": "F4EF9CA513BBD0855C7C2126355A17B42EEB2EDED13AAAB1F9A0A76FA57FD822",
      "byte_count": 6357
    },
    "golden_schema": {
      "path": "specs/native-boot-handoff-golden-vectors.schema.json",
      "sha256": "67CA560C0259C1022D8A81C4003E2F40416BCB381CB4634309B697EF4F723070",
      "byte_count": 1472
    },
    "readiness_schema": {
      "path": "specs/native-boot-handoff-readiness.schema.json",
      "sha256": "DEF4C046397F11C0DC69F8D13335B68EB1306003A4C0D87FC11A5F2841844325",
      "byte_count": 2292
    },
    "implementation_inputs": [
      {
        "path": "native/Cargo.toml",
        "sha256": "210BCDAF2778606B42C688E7BACD950FC0EEF3045081E884CF7846B9A7D78DF4",
        "byte_count": 601
      },
      {
        "path": "native/Cargo.lock",
        "sha256": "29CE9938C5C60DEA5AEA244A6961BB1924D88AEC601D1E02EAAA510B0B36E390",
        "byte_count": 4193
      },
      {
        "path": "native/handoff/Cargo.toml",
        "sha256": "9D92AEBADF8F80E38FC4D3B2832CDE7BEE91E65E9C67AF566B475979F7804325",
        "byte_count": 340
      },
      {
        "path": "native/handoff/README.md",
        "sha256": "D307E6716E031DF49E1901771F15AEC3FF9973AA44FD0144F7FFE718184820FE",
        "byte_count": 967
      },
      {
        "path": "native/handoff/src/lib.rs",
        "sha256": "983DAFD71E0B892F6F98C614D43600CBEBDDBD7C0AA1E2D81CDAA545E165B110",
        "byte_count": 48608
      },
      {
        "path": "native/handoff/src/bin/pbp1_probe.rs",
        "sha256": "58243B2FD8B35FAB473C50EF90DAAC27711C637BD6E5B4DD7BC0F347EAA1AFE7",
        "byte_count": 1093
      },
      {
        "path": "runtime/native_boot_handoff.py",
        "sha256": "89071EAC531B6DD0E47930A3295B92570201C2EA60277C4CCF87A5E4E684CFE1",
        "byte_count": 47432
      },
      {
        "path": "tools/generate_native_boot_handoff_vectors.py",
        "sha256": "3032F71A2134B18D236E426C9B27AC81EAF418B8A25065EEF4A4C05749CE8467",
        "byte_count": 1491
      },
      {
        "path": "tools/qualify_native_boot_handoff.py",
        "sha256": "7E66F3EA70C8029AAF806A85CCCFC0E427A2378B8BEF9A07F2448A219E5D15CC",
        "byte_count": 25129
      },
      {
        "path": "tests/test_native_boot_handoff.py",
        "sha256": "53A11199CB20F8C40D36D848988B41AA6449C84647B89EBD68C067103B465A72",
        "byte_count": 5434
      },
      {
        "path": "docs/native-boot-handoff.md",
        "sha256": "AE4A52DBD55FAD8296636E2E90958E82F2DEF4AEE3F390E896EAACF809FB39C0",
        "byte_count": 8867
      }
    ]
  },
  "codec_qualification": {
    "rustc_version_sha256": "F3C960598A5E9037C4CF8E4AA06C018171ABF07C381D165C3986C6A954DEA1BB",
    "rust_host_target": "x86_64-pc-windows-msvc",
    "rust_host_test_count": 8,
    "rust_host_test_pass_count": 8,
    "no_std_target_builds": [
      {
        "target": "x86_64-unknown-uefi",
        "status": "pass",
        "byte_count": 101068,
        "sha256": "DCF41FA2D36DE89406838FAA436F1C3FB3DDD6DBD5AC132F97AA9722F24A0D78"
      },
      {
        "target": "x86_64-unknown-none",
        "status": "pass",
        "byte_count": 106070,
        "sha256": "60A12736A314427635A16204C1A6D939F10683CFF555B2FD7823785136590D12"
      }
    ],
    "layout_assertion_count": 12,
    "host_probe_byte_count": 139776,
    "host_probe_artifact_identity_recorded": false,
    "host_probe_role": "ephemeral host-only differential transport"
  },
  "golden_vectors": [
    {
      "id": "full_kernel_entry_v1",
      "sha256": "28A9F1AEF191F72FF66DFD6C93021716C0EF96CF5B2DBB48F09FC625F6BE742A",
      "byte_count": 1488,
      "python_decode": "pass",
      "rust_decode": "pass",
      "kernel_entry_profile": true,
      "synthetic": true
    },
    {
      "id": "minimal_v1",
      "sha256": "BDC85308659473920C193357F4EC8BFA3B6F143EB385E341AD233C56DC26224C",
      "byte_count": 456,
      "python_decode": "pass",
      "rust_decode": "pass",
      "kernel_entry_profile": false,
      "synthetic": true
    },
    {
      "id": "forward_optional_v1_1",
      "sha256": "A6DF3CA4492AE9479DD4AF75963D1409EFD63121C7108E7F2CE81ADB0A7B4EA4",
      "byte_count": 496,
      "python_decode": "pass",
      "rust_decode": "pass",
      "kernel_entry_profile": false,
      "synthetic": true
    }
  ],
  "negative_controls": [
    {
      "id": "NEG-N5-PBP1-MAGIC",
      "surface": "decode",
      "expected": "reject",
      "python_observed": "reject",
      "rust_observed": "reject",
      "status": "pass",
      "input_sha256": "3198E21252CD5991EEC86F6AE154316E6918B6CDAF149817C3EB0D840F2B2139",
      "input_byte_count": 1488
    },
    {
      "id": "NEG-N5-PBP1-MAJOR-DOWNGRADE",
      "surface": "decode",
      "expected": "reject",
      "python_observed": "reject",
      "rust_observed": "reject",
      "status": "pass",
      "input_sha256": "F4CFDCDBD1D9CCAC93EDCDC54F85B036D3C91285731B273A62549A979B591C62",
      "input_byte_count": 1488
    },
    {
      "id": "NEG-N5-PBP1-MAJOR-FUTURE",
      "surface": "decode",
      "expected": "reject",
      "python_observed": "reject",
      "rust_observed": "reject",
      "status": "pass",
      "input_sha256": "01E7554E99FA8A9420340ECCEEF176C18F5D347296A08A3DBDC120F4FDC6CD1C",
      "input_byte_count": 1488
    },
    {
      "id": "NEG-N5-PBP1-READER-MINOR",
      "surface": "decode",
      "expected": "reject",
      "python_observed": "reject",
      "rust_observed": "reject",
      "status": "pass",
      "input_sha256": "F66F81142908B364E795F9966C2BA4EEFBC124EFCEBBC04BF199916E34A914ED",
      "input_byte_count": 1488
    },
    {
      "id": "NEG-N5-PBP1-HEADER-SIZE",
      "surface": "decode",
      "expected": "reject",
      "python_observed": "reject",
      "rust_observed": "reject",
      "status": "pass",
      "input_sha256": "8090E8450E22EDC81CBD917BBD477E32408A4D4ECFB6146FE52488315BD9A2A0",
      "input_byte_count": 1488
    },
    {
      "id": "NEG-N5-PBP1-TOTAL-SIZE",
      "surface": "decode",
      "expected": "reject",
      "python_observed": "reject",
      "rust_observed": "reject",
      "status": "pass",
      "input_sha256": "15BC5C763BE6BF21DD3A4F29A62B22FC639C88799D05D8F09449064D5B00C100",
      "input_byte_count": 1488
    },
    {
      "id": "NEG-N5-PBP1-HEADER-FLAGS",
      "surface": "decode",
      "expected": "reject",
      "python_observed": "reject",
      "rust_observed": "reject",
      "status": "pass",
      "input_sha256": "8B3DFF56231976FDCE6499954F438E8DBE816DD643D5D1A3EFE9F13FF02CC19B",
      "input_byte_count": 1488
    },
    {
      "id": "NEG-N5-PBP1-HEADER-RESERVED",
      "surface": "decode",
      "expected": "reject",
      "python_observed": "reject",
      "rust_observed": "reject",
      "status": "pass",
      "input_sha256": "E606CF1533EB8857E7685F8371CF39A598E2C7CD5429BB43D4ECC03ED1C38A0E",
      "input_byte_count": 1488
    },
    {
      "id": "NEG-N5-PBP1-MESSAGE-CRC",
      "surface": "decode",
      "expected": "reject",
      "python_observed": "reject",
      "rust_observed": "reject",
      "status": "pass",
      "input_sha256": "C0A5256A2AFECB8A066A7FDA4DBF382EB812D4C0AF94C2F584E50CFE1F9E1EAA",
      "input_byte_count": 1488
    },
    {
      "id": "NEG-N5-PBP1-RECORD-ORDER",
      "surface": "decode",
      "expected": "reject",
      "python_observed": "reject",
      "rust_observed": "reject",
      "status": "pass",
      "input_sha256": "8AD958F05EB0C7E32C86963084A1DD7DAD57E1BBA5BDAD8B2965A09BE8701803",
      "input_byte_count": 1488
    },
    {
      "id": "NEG-N5-PBP1-RECORD-OFFSET",
      "surface": "decode",
      "expected": "reject",
      "python_observed": "reject",
      "rust_observed": "reject",
      "status": "pass",
      "input_sha256": "C392DED69482C02BBAED7980CA78D0F21D9FAB3CCE57ECEA53FB171E9B42F2AC",
      "input_byte_count": 1488
    },
    {
      "id": "NEG-N5-PBP1-RECORD-LENGTH",
      "surface": "decode",
      "expected": "reject",
      "python_observed": "reject",
      "rust_observed": "reject",
      "status": "pass",
      "input_sha256": "9AC1D0F6314A726FAAA9B7C9506F9EF4611DDEDBB2BBCD68104562FA3240CFC6",
      "input_byte_count": 1488
    },
    {
      "id": "NEG-N5-PBP1-RECORD-CRC",
      "surface": "decode",
      "expected": "reject",
      "python_observed": "reject",
      "rust_observed": "reject",
      "status": "pass",
      "input_sha256": "81F9FB611703D7836DC826F6349FD2D9C4CD2B1F7CDD90DD290EADD9E84B6C6F",
      "input_byte_count": 1488
    },
    {
      "id": "NEG-N5-PBP1-RECORD-FLAGS",
      "surface": "decode",
      "expected": "reject",
      "python_observed": "reject",
      "rust_observed": "reject",
      "status": "pass",
      "input_sha256": "BD205A1A94455286B72FB2BA0A47F0D7F50E94D88D6B22E298C7837565F33FE5",
      "input_byte_count": 1488
    },
    {
      "id": "NEG-N5-PBP1-UNKNOWN-REQUIRED",
      "surface": "decode",
      "expected": "reject",
      "python_observed": "reject",
      "rust_observed": "reject",
      "status": "pass",
      "input_sha256": "9A52C29433478A7311C3CBCCB2B1FD7051F9897B0A37E6E7DA6D3182303A3CE2",